{
  "version": 1,
  "orderRules": {
    "notesMaxLength": 200,
    "minQuantity": 1,
    "maxQuantity": 10
  },
  "categories": [
    {
      "id": "ca-phe",
      "nameVi": "Cà Phê",
      "name": "Coffee"
    },
    {
      "id": "mat-cha",
      "nameVi": "Mát-cha",
      "name": "Matcha"
    },
    {
      "id": "tra",
      "nameVi": "Trà",
      "name": "Tea"
    },
    {
      "id": "giai-khat",
      "nameVi": "Giải Khát",
      "name": "Refreshers"
    },
    {
      "id": "kem",
      "nameVi": "Kem",
      "name": "Cold Foams"
    }
  ],
  "modifierGroups": [
    {
      "id": "sweetness",
      "dimension": "sweetness_level",
      "name": "Sweetness",
      "required": true,
      "options": [
        {
          "id": "full",
          "name": "Full sweetness",
          "temperatures": [
            "hot",
            "iced"
          ]
        },
        {
          "id": "75",
          "name": "75%",
          "temperatures": [
            "hot",
            "iced"
          ]
        },
        {
          "id": "50",
          "name": "50%",
          "temperatures": [
            "hot",
            "iced"
          ]
        },
        {
          "id": "25",
          "name": "25%",
          "temperatures": [
            "hot",
            "iced"
          ]
        },
        {
          "id": "none",
          "name": "No sweetener",
          "temperatures": [
            "hot",
            "iced"
          ]
        }
      ],
      "defaultOptionId": "full"
    },
    {
      "id": "cold-foam",
      "dimension": "cold_foam",
      "name": "Cold foam",
      "required": false,
      "options": [
        {
          "id": "foam-base",
          "name": "Base Foam",
          "temperatures": [
            "iced"
          ]
        },
        {
          "id": "foam-salted",
          "name": "Salted Cold Foam",
          "temperatures": [
            "iced"
          ]
        },
        {
          "id": "foam-matcha",
          "name": "Matcha Cold Foam",
          "temperatures": [
            "iced"
          ]
        },
        {
          "id": "foam-cheese",
          "name": "Cheese Cold Foam",
          "temperatures": [
            "iced"
          ]
        },
        {
          "id": "foam-strawberry",
          "name": "Strawberry Cold Foam",
          "temperatures": [
            "iced"
          ]
        },
        {
          "id": "foam-cocoa",
          "name": "Cocoa Cold Foam",
          "temperatures": [
            "iced"
          ]
        },
        {
          "id": "foam-tea",
          "name": "Tea Cold Foam",
          "temperatures": [
            "iced"
          ]
        },
        {
          "id": "foam-yogurt",
          "name": "Yogurt Cold Foam",
          "temperatures": [
            "iced"
          ]
        }
      ]
    },
    {
      "id": "milk-matcha-latte",
      "dimension": "milk",
      "name": "Milk",
      "required": true,
      "options": [
        {
          "id": "whole-milk",
          "name": "Whole milk",
          "temperatures": [
            "hot"
          ]
        },
        {
          "id": "oat-milk",
          "name": "Oat milk",
          "temperatures": [
            "hot",
            "iced"
          ]
        },
        {
          "id": "milk-plus-cream",
          "name": "Milk + heavy cream",
          "temperatures": [
            "iced"
          ]
        },
        {
          "id": "heavy-cream",
          "name": "Heavy whipping cream",
          "temperatures": [
            "iced"
          ]
        },
        {
          "id": "half-and-half",
          "name": "Half and half",
          "temperatures": [
            "iced"
          ]
        }
      ],
      "defaultByTemperature": {
        "hot": "whole-milk",
        "iced": "milk-plus-cream"
      }
    },
    {
      "id": "milk-house-latte",
      "dimension": "milk",
      "name": "Milk",
      "required": true,
      "options": [
        {
          "id": "whole-milk",
          "name": "Whole milk",
          "temperatures": [
            "hot"
          ]
        },
        {
          "id": "milk-plus-cream",
          "name": "Milk + heavy cream",
          "temperatures": [
            "iced"
          ]
        },
        {
          "id": "heavy-cream",
          "name": "Heavy whipping cream",
          "temperatures": [
            "iced"
          ]
        },
        {
          "id": "half-and-half",
          "name": "Half and half",
          "temperatures": [
            "iced"
          ]
        }
      ],
      "defaultByTemperature": {
        "hot": "whole-milk",
        "iced": "milk-plus-cream"
      }
    },
    {
      "id": "milk-cortado",
      "dimension": "milk",
      "name": "Milk",
      "required": true,
      "options": [
        {
          "id": "whole-milk",
          "name": "Whole milk",
          "temperatures": [
            "hot"
          ]
        },
        {
          "id": "oat-milk",
          "name": "Oat milk",
          "temperatures": [
            "hot"
          ]
        }
      ],
      "defaultByTemperature": {
        "hot": "whole-milk"
      }
    },
    {
      "id": "milk-strawberry",
      "dimension": "milk",
      "name": "Milk",
      "required": true,
      "options": [
        {
          "id": "whole-milk",
          "name": "Whole milk",
          "temperatures": [
            "iced"
          ]
        },
        {
          "id": "two-percent-milk",
          "name": "2% milk",
          "temperatures": [
            "iced"
          ]
        }
      ],
      "defaultByTemperature": {
        "iced": "whole-milk"
      }
    },
    {
      "id": "sweetener-matcha",
      "dimension": "sweetener_type",
      "name": "Sweetener",
      "required": true,
      "options": [
        {
          "id": "condensed-milk",
          "name": "Condensed milk",
          "temperatures": [
            "hot",
            "iced"
          ]
        },
        {
          "id": "turbinado-syrup",
          "name": "Turbinado syrup",
          "temperatures": [
            "hot",
            "iced"
          ]
        }
      ],
      "defaultOptionId": "condensed-milk"
    },
    {
      "id": "sweetener-undertow",
      "dimension": "sweetener_type",
      "name": "Sweetener",
      "required": true,
      "options": [
        {
          "id": "turbinado-syrup",
          "name": "Turbinado syrup",
          "temperatures": [
            "hot"
          ]
        },
        {
          "id": "condensed-milk",
          "name": "Condensed milk",
          "temperatures": [
            "hot"
          ]
        }
      ],
      "defaultOptionId": "turbinado-syrup"
    },
    {
      "id": "sweetener-matcha-undertow",
      "dimension": "sweetener_type",
      "name": "Sweetener",
      "required": true,
      "options": [
        {
          "id": "turbinado-syrup",
          "name": "Turbinado syrup",
          "temperatures": [
            "hot"
          ]
        },
        {
          "id": "condensed-milk",
          "name": "Condensed milk",
          "temperatures": [
            "hot"
          ]
        },
        {
          "id": "strawberry-cheong",
          "name": "Strawberry cheong",
          "temperatures": [
            "hot"
          ]
        }
      ],
      "defaultOptionId": "turbinado-syrup"
    }
  ],
  "items": [
    {
      "id": "black-coffee",
      "name": "Black Coffee",
      "nameVi": "Cà Phê Đen",
      "description": "Coffee served straight, hot or over ice. The short version is more intense; the long version is fuller and milder.",
      "categoryId": "ca-phe",
      "temperatures": [
        "hot",
        "iced"
      ],
      "modifierGroupIds": [
        "sweetness",
        "cold-foam"
      ]
    },
    {
      "id": "sua-da",
      "name": "Vietnamese Iced Coffee",
      "nameVi": "Sữa Đá",
      "description": "Dark-roast concentrate over Ông Thọ condensed milk, hot or over ice.",
      "categoryId": "ca-phe",
      "temperatures": [
        "hot",
        "iced"
      ],
      "modifierGroupIds": [
        "sweetness",
        "cold-foam"
      ]
    },
    {
      "id": "saigon-white-coffee",
      "name": "Saigon White Coffee",
      "nameVi": "Cà Phê Bạc Xỉu",
      "description": "Southern Vietnam's milkier, sweeter cup: more milk than coffee over sweetened condensed milk.",
      "categoryId": "ca-phe",
      "temperatures": [
        "hot",
        "iced"
      ],
      "modifierGroupIds": [
        "sweetness",
        "cold-foam"
      ]
    },
    {
      "id": "egg-coffee",
      "name": "Egg Coffee",
      "nameVi": "Cà Phê Trứng",
      "description": "Northern Vietnam's custard-cap coffee: strong coffee under a dense egg foam.",
      "categoryId": "ca-phe",
      "temperatures": [
        "hot",
        "iced"
      ],
      "modifierGroupIds": [
        "sweetness",
        "cold-foam"
      ]
    },
    {
      "id": "cortado",
      "name": "Cortado",
      "nameVi": "Cortado",
      "description": "Equal parts concentrate and silky steamed milk.",
      "categoryId": "ca-phe",
      "temperatures": [
        "hot"
      ],
      "modifierGroupIds": [
        "milk-cortado"
      ]
    },
    {
      "id": "house-latte",
      "name": "House Latte",
      "nameVi": "House Latte",
      "description": "Coffee concentrate sweetened with turbinado sugar, your choice of milk.",
      "categoryId": "ca-phe",
      "temperatures": [
        "hot",
        "iced"
      ],
      "modifierGroupIds": [
        "milk-house-latte",
        "sweetness",
        "cold-foam"
      ]
    },
    {
      "id": "ca-phe-cacao",
      "name": "Mocha",
      "nameVi": "Cà Phê Cacao",
      "description": "Cocoa folded into hot concentrate, finished with frothed milk.",
      "categoryId": "ca-phe",
      "temperatures": [
        "hot",
        "iced"
      ],
      "modifierGroupIds": [
        "sweetness",
        "cold-foam"